page,event,category,subcategory,X,x1
search home product cart product home product home home category,hover scroll click click remove add_to_cart checkout_click scroll hover remove,sports fashion groceries fashion home_appliances sports electronics sports groceries home_appliances,gym_equipment men_clothing vegetables men_clothing washing_machine cricket mobile cricket vegetables washing_machine,search hover sports gym_equipment home scroll fashion men_clothing product click groceries vegetables cart click fashion men_clothing product remove home_appliances washing_machine home add_to_cart sports cricket product checkout_click electronics mobile home scroll sports cricket home hover groceries vegetables category remove home_appliances washing_machine,search hover home scroll product click cart click product remove home add_to_cart product checkout_click home scroll home hover category remove
cart search category home cart checkout search cart profile product,add_to_cart click checkout_click click scroll click remove scroll checkout_click click,electronics home_appliances groceries electronics groceries groceries groceries groceries fashion electronics,laptop microwave fruits laptop fruits fruits vegetables beverages men_clothing mobile,cart add_to_cart electronics laptop search click home_appliances microwave category checkout_click groceries fruits home click electronics laptop cart scroll groceries fruits checkout click groceries fruits search remove groceries vegetables cart scroll groceries beverages profile checkout_click fashion men_clothing product click electronics mobile,cart add_to_cart search click category checkout_click home click cart scroll checkout click search remove cart scroll profile checkout_click product click
cart home search category profile profile checkout search cart checkout category search product,remove click hover remove hover click click click checkout_click remove add_to_cart hover checkout_click,groceries books books electronics sports electronics fashion electronics electronics fashion home_appliances electronics electronics,beverages nonfiction nonfiction mobile gym_equipment laptop shoes mobile camera women_clothing refrigerator camera laptop,cart remove groceries beverages home click books nonfiction search hover books nonfiction category remove electronics mobile profile hover sports gym_equipment profile click electronics laptop checkout click fashion shoes search click electronics mobile cart checkout_click electronics camera checkout remove fashion women_clothing category add_to_cart home_appliances refrigerator search hover electronics camera product checkout_click electronics laptop,cart remove home click search hover category remove profile hover profile click checkout click search click cart checkout_click checkout remove category add_to_cart search hover product checkout_click
checkout cart category home cart search search checkout cart home checkout checkout home search product,scroll scroll add_to_cart remove click hover hover hover checkout_click add_to_cart add_to_cart remove checkout_click add_to_cart remove,books sports home_appliances books sports electronics sports home_appliances sports sports books sports books home_appliances home_appliances,fiction football washing_machine comics cricket camera gym_equipment washing_machine football gym_equipment comics football comics washing_machine washing_machine,checkout scroll books fiction cart scroll sports football category add_to_cart home_appliances washing_machine home remove books comics cart click sports cricket search hover electronics camera search hover sports gym_equipment checkout hover home_appliances washing_machine cart checkout_click sports football home add_to_cart sports gym_equipment checkout add_to_cart books comics checkout remove sports football home checkout_click books comics search add_to_cart home_appliances washing_machine product remove home_appliances washing_machine,checkout scroll cart scroll category add_to_cart home remove cart click search hover search hover checkout hover cart checkout_click home add_to_cart checkout add_to_cart checkout remove home checkout_click search add_to_cart product remove
home search category search product category cart,scroll hover checkout_click remove click checkout_click remove,sports sports books sports sports electronics sports,cricket football nonfiction cricket gym_equipment camera football,home scroll sports cricket search hover sports football category checkout_click books nonfiction search remove sports cricket product click sports gym_equipment category checkout_click electronics camera cart remove sports football,home scroll search hover category checkout_click search remove product click category checkout_click cart remove
home profile product profile profile home search cart home product,click add_to_cart remove remove checkout_click scroll scroll click click scroll,books home_appliances groceries electronics sports books home_appliances fashion fashion groceries,comics microwave fruits laptop cricket fiction refrigerator women_clothing women_clothing beverages,home click books comics profile add_to_cart home_appliances microwave product remove groceries fruits profile remove electronics laptop profile checkout_click sports cricket home scroll books fiction search scroll home_appliances refrigerator cart click fashion women_clothing home click fashion women_clothing product scroll groceries beverages,home click profile add_to_cart product remove profile remove profile checkout_click home scroll search scroll cart click home click product scroll
profile profile category product product product product home home checkout home cart,hover hover checkout_click checkout_click add_to_cart add_to_cart scroll scroll scroll scroll scroll click,groceries electronics fashion sports groceries home_appliances books groceries books books books home_appliances,beverages camera women_clothing football fruits refrigerator fiction beverages fiction comics fiction refrigerator,profile hover groceries beverages profile hover electronics camera category checkout_click fashion women_clothing product checkout_click sports football product add_to_cart groceries fruits product add_to_cart home_appliances refrigerator product scroll books fiction home scroll groceries beverages home scroll books fiction checkout scroll books comics home scroll books fiction cart click home_appliances refrigerator,profile hover profile hover category checkout_click product checkout_click product add_to_cart product add_to_cart product scroll home scroll home scroll checkout scroll home scroll cart click
cart cart profile checkout home,remove click checkout_click add_to_cart remove,fashion sports electronics sports home_appliances,women_clothing cricket camera football refrigerator,cart remove fashion women_clothing cart click sports cricket profile checkout_click electronics camera checkout add_to_cart sports football home remove home_appliances refrigerator,cart remove cart click profile checkout_click checkout add_to_cart home remove
cart profile cart checkout search category product cart checkout profile home,remove add_to_cart remove click click remove checkout_click add_to_cart remove add_to_cart remove,groceries books electronics books books sports sports sports groceries home_appliances home_appliances,fruits nonfiction laptop fiction fiction gym_equipment football gym_equipment fruits washing_machine microwave,cart remove groceries fruits profile add_to_cart books nonfiction cart remove electronics laptop checkout click books fiction search click books fiction category remove sports gym_equipment product checkout_click sports football cart add_to_cart sports gym_equipment checkout remove groceries fruits profile add_to_cart home_appliances washing_machine home remove home_appliances microwave,cart remove profile add_to_cart cart remove checkout click search click category remove product checkout_click cart add_to_cart checkout remove profile add_to_cart home remove
profile cart home cart product profile profile product profile cart search cart category cart,click click checkout_click hover hover hover scroll remove checkout_click checkout_click remove add_to_cart add_to_cart checkout_click,electronics electronics electronics groceries electronics groceries home_appliances electronics books groceries fashion groceries books home_appliances,mobile camera camera fruits mobile beverages refrigerator mobile nonfiction beverages shoes fruits fiction refrigerator,profile click electronics mobile cart click electronics camera home checkout_click electronics camera cart hover groceries fruits product hover electronics mobile profile hover groceries beverages profile scroll home_appliances refrigerator product remove electronics mobile profile checkout_click books nonfiction cart checkout_click groceries beverages search remove fashion shoes cart add_to_cart groceries fruits category add_to_cart books fiction cart checkout_click home_appliances refrigerator,profile click cart click home checkout_click cart hover product hover profile hover profile scroll product remove profile checkout_click cart checkout_click search remove cart add_to_cart category add_to_cart cart checkout_click
profile home home product search profile product search search product cart home category checkout,click checkout_click checkout_click hover click click checkout_click scroll add_to_cart add_to_cart remove hover hover checkout_click,fashion home_appliances books sports fashion home_appliances home_appliances groceries electronics groceries home_appliances electronics home_appliances groceries,shoes refrigerator fiction football women_clothing refrigerator washing_machine fruits mobile fruits microwave laptop refrigerator fruits,profile click fashion shoes home checkout_click home_appliances refrigerator home checkout_click books fiction product hover sports football search click fashion women_clothing profile click home_appliances refrigerator product checkout_click home_appliances washing_machine search scroll groceries fruits search add_to_cart electronics mobile product add_to_cart groceries fruits cart remove home_appliances microwave home hover electronics laptop category hover home_appliances refrigerator checkout checkout_click groceries fruits,profile click home checkout_click home checkout_click product hover search click profile click product checkout_click search scroll search add_to_cart product add_to_cart cart remove home hover category hover checkout checkout_click
checkout checkout profile cart checkout profile category product,add_to_cart remove hover click scroll remove add_to_cart add_to_cart,electronics home_appliances sports home_appliances electronics sports fashion groceries,laptop microwave football microwave camera football women_clothing beverages,checkout add_to_cart electronics laptop checkout remove home_appliances microwave profile hover sports football cart click home_appliances microwave checkout scroll electronics camera profile remove sports football category add_to_cart fashion women_clothing product add_to_cart groceries beverages,checkout add_to_cart checkout remove profile hover cart click checkout scroll profile remove category add_to_cart product add_to_cart
category product profile product category category home checkout category category home product cart,hover click add_to_cart add_to_cart add_to_cart click click checkout_click add_to_cart scroll remove checkout_click add_to_cart,home_appliances electronics sports fashion electronics books fashion electronics books books books home_appliances sports,microwave camera gym_equipment shoes camera comics men_clothing camera comics nonfiction nonfiction refrigerator football,category hover home_appliances microwave product click electronics camera profile add_to_cart sports gym_equipment product add_to_cart fashion shoes category add_to_cart electronics camera category click books comics home click fashion men_clothing checkout checkout_click electronics camera category add_to_cart books comics category scroll books nonfiction home remove books nonfiction product checkout_click home_appliances refrigerator cart add_to_cart sports football,category hover product click profile add_to_cart product add_to_cart category add_to_cart category click home click checkout checkout_click category add_to_cart category scroll home remove product checkout_click cart add_to_cart
cart category checkout search product home cart product checkout product checkout product,checkout_click remove add_to_cart click click click scroll add_to_cart click scroll checkout_click hover,home_appliances books books fashion sports home_appliances books groceries groceries home_appliances home_appliances electronics,refrigerator fiction fiction men_clothing cricket washing_machine nonfiction beverages beverages refrigerator washing_machine laptop,cart checkout_click home_appliances refrigerator category remove books fiction checkout add_to_cart books fiction search click fashion men_clothing product click sports cricket home click home_appliances washing_machine cart scroll books nonfiction product add_to_cart groceries beverages checkout click groceries beverages product scroll home_appliances refrigerator checkout checkout_click home_appliances washing_machine product hover electronics laptop,cart checkout_click category remove checkout add_to_cart search click product click home click cart scroll product add_to_cart checkout click product scroll checkout checkout_click product hover
checkout checkout home category home product product profile checkout search product,hover checkout_click remove scroll scroll hover remove checkout_click scroll checkout_click scroll,books sports groceries home_appliances books fashion books sports fashion fashion electronics,fiction football beverages microwave comics men_clothing fiction gym_equipment women_clothing women_clothing camera,checkout hover books fiction checkout checkout_click sports football home remove groceries beverages category scroll home_appliances microwave home scroll books comics product hover fashion men_clothing product remove books fiction profile checkout_click sports gym_equipment checkout scroll fashion women_clothing search checkout_click fashion women_clothing product scroll electronics camera,checkout hover checkout checkout_click home remove category scroll home scroll product hover product remove profile checkout_click checkout scroll search checkout_click product scroll
home home category home cart checkout profile home profile search profile product cart checkout,hover scroll add_to_cart remove click add_to_cart checkout_click click checkout_click hover scroll checkout_click remove hover,home_appliances sports books books sports electronics sports electronics books groceries electronics home_appliances groceries fashion,microwave cricket fiction nonfiction cricket mobile football laptop nonfiction beverages laptop refrigerator vegetables men_clothing,home hover home_appliances microwave home scroll sports cricket category add_to_cart books fiction home remove books nonfiction cart click sports cricket checkout add_to_cart electronics mobile profile checkout_click sports football home click electronics laptop profile checkout_click books nonfiction search hover groceries beverages profile scroll electronics laptop product checkout_click home_appliances refrigerator cart remove groceries vegetables checkout hover fashion men_clothing,home hover home scroll category add_to_cart home remove cart click checkout add_to_cart profile checkout_click home click profile checkout_click search hover profile scroll product checkout_click cart remove checkout hover
cart cart cart checkout checkout cart cart category product home checkout home,checkout_click add_to_cart click scroll checkout_click hover click remove add_to_cart checkout_click add_to_cart add_to_cart,home_appliances groceries sports books books sports electronics fashion fashion electronics groceries electronics,refrigerator fruits gym_equipment comics comics cricket mobile shoes women_clothing laptop beverages laptop,cart checkout_click home_appliances refrigerator cart add_to_cart groceries fruits cart click sports gym_equipment checkout scroll books comics checkout checkout_click books comics cart hover sports cricket cart click electronics mobile category remove fashion shoes product add_to_cart fashion women_clothing home checkout_click electronics laptop checkout add_to_cart groceries beverages home add_to_cart electronics laptop,cart checkout_click cart add_to_cart cart click checkout scroll checkout checkout_click cart hover cart click category remove product add_to_cart home checkout_click checkout add_to_cart home add_to_cart
home cart checkout checkout checkout cart product product product,remove click scroll scroll checkout_click click scroll scroll checkout_click,home_appliances sports home_appliances sports electronics groceries electronics books fashion,washing_machine cricket microwave football camera beverages mobile nonfiction women_clothing,home remove home_appliances washing_machine cart click sports cricket checkout scroll home_appliances microwave checkout scroll sports football checkout checkout_click electronics camera cart click groceries beverages product scroll electronics mobile product scroll books nonfiction product checkout_click fashion women_clothing,home remove cart click checkout scroll checkout scroll checkout checkout_click cart click product scroll product scroll product checkout_click
profile profile checkout home checkout search home product product product cart home,add_to_cart remove checkout_click remove remove scroll remove checkout_click click add_to_cart scroll remove,groceries groceries fashion home_appliances electronics books electronics sports fashion electronics books books,beverages fruits shoes refrigerator mobile fiction laptop cricket shoes laptop fiction nonfiction,profile add_to_cart groceries beverages profile remove groceries fruits checkout checkout_click fashion shoes home remove home_appliances refrigerator checkout remove electronics mobile search scroll books fiction home remove electronics laptop product checkout_click sports cricket product click fashion shoes product add_to_cart electronics laptop cart scroll books fiction home remove books nonfiction,profile add_to_cart profile remove checkout checkout_click home remove checkout remove search scroll home remove product checkout_click product click product add_to_cart cart scroll home remove
profile cart profile search home cart cart,remove hover add_to_cart click add_to_cart scroll scroll,fashion groceries electronics books home_appliances sports electronics,women_clothing fruits mobile fiction microwave football camera,profile remove fashion women_clothing cart hover groceries fruits profile add_to_cart electronics mobile search click books fiction home add_to_cart home_appliances microwave cart scroll sports football cart scroll electronics camera,profile remove cart hover profile add_to_cart search click home add_to_cart cart scroll cart scroll
profile profile checkout product cart,scroll add_to_cart add_to_cart add_to_cart hover,home_appliances books fashion sports groceries,washing_machine comics women_clothing gym_equipment vegetables,profile scroll home_appliances washing_machine profile add_to_cart books comics checkout add_to_cart fashion women_clothing product add_to_cart sports gym_equipment cart hover groceries vegetables,profile scroll profile add_to_cart checkout add_to_cart product add_to_cart cart hover
home checkout product search home home checkout search cart search category,remove scroll click hover scroll add_to_cart scroll click add_to_cart click checkout_click,books sports fashion books fashion fashion sports home_appliances sports sports books,nonfiction gym_equipment women_clothing nonfiction shoes men_clothing football washing_machine football gym_equipment nonfiction,home remove books nonfiction checkout scroll sports gym_equipment product click fashion women_clothing search hover books nonfiction home scroll fashion shoes home add_to_cart fashion men_clothing checkout scroll sports football search click home_appliances washing_machine cart add_to_cart sports football search click sports gym_equipment category checkout_click books nonfiction,home remove checkout scroll product click search hover home scroll home add_to_cart checkout scroll search click cart add_to_cart search click category checkout_click
cart category cart profile product home cart cart,scroll add_to_cart scroll remove remove add_to_cart checkout_click add_to_cart,fashion sports electronics sports groceries sports electronics books,women_clothing cricket mobile cricket fruits football laptop comics,cart scroll fashion women_clothing category add_to_cart sports cricket cart scroll electronics mobile profile remove sports cricket product remove groceries fruits home add_to_cart sports football cart checkout_click electronics laptop cart add_to_cart books comics,cart scroll category add_to_cart cart scroll profile remove product remove home add_to_cart cart checkout_click cart add_to_cart
cart product category profile category profile profile home search search search,add_to_cart add_to_cart add_to_cart hover remove scroll hover click scroll add_to_cart add_to_cart,books groceries fashion home_appliances home_appliances electronics home_appliances sports groceries fashion electronics,comics beverages men_clothing refrigerator refrigerator camera refrigerator gym_equipment fruits men_clothing mobile,cart add_to_cart books comics product add_to_cart groceries beverages category add_to_cart fashion men_clothing profile hover home_appliances refrigerator category remove home_appliances refrigerator profile scroll electronics camera profile hover home_appliances refrigerator home click sports gym_equipment search scroll groceries fruits search add_to_cart fashion men_clothing search add_to_cart electronics mobile,cart add_to_cart product add_to_cart category add_to_cart profile hover category remove profile scroll profile hover home click search scroll search add_to_cart search add_to_cart
profile product category search search category cart home product cart profile category profile search category,hover remove click add_to_cart click click add_to_cart hover checkout_click hover scroll add_to_cart add_to_cart checkout_click checkout_click,books books sports electronics home_appliances groceries sports home_appliances books groceries home_appliances sports books groceries sports,nonfiction comics gym_equipment camera microwave vegetables gym_equipment washing_machine nonfiction beverages washing_machine gym_equipment comics vegetables cricket,profile hover books nonfiction product remove books comics category click sports gym_equipment search add_to_cart electronics camera search click home_appliances microwave category click groceries vegetables cart add_to_cart sports gym_equipment home hover home_appliances washing_machine product checkout_click books nonfiction cart hover groceries beverages profile scroll home_appliances washing_machine category add_to_cart sports gym_equipment profile add_to_cart books comics search checkout_click groceries vegetables category checkout_click sports cricket,profile hover product remove category click search add_to_cart search click category click cart add_to_cart home hover product checkout_click cart hover profile scroll category add_to_cart profile add_to_cart search checkout_click category checkout_click
checkout category profile checkout cart,scroll hover click click checkout_click,sports home_appliances electronics fashion groceries,cricket washing_machine camera shoes fruits,checkout scroll sports cricket category hover home_appliances washing_machine profile click electronics camera checkout click fashion shoes cart checkout_click groceries fruits,checkout scroll category hover profile click checkout click cart checkout_click
cart checkout product cart category product product,scroll remove remove remove add_to_cart remove hover,books electronics fashion fashion home_appliances books groceries,comics mobile men_clothing shoes washing_machine fiction fruits,cart scroll books comics checkout remove electronics mobile product remove fashion men_clothing cart remove fashion shoes category add_to_cart home_appliances washing_machine product remove books fiction product hover groceries fruits,cart scroll checkout remove product remove cart remove category add_to_cart product remove product hover
cart search home checkout home home checkout home search product category home product category,remove checkout_click remove checkout_click remove click click scroll checkout_click remove remove hover click checkout_click,electronics books books fashion books home_appliances groceries sports fashion fashion groceries fashion electronics fashion,camera comics nonfiction women_clothing nonfiction microwave beverages gym_equipment women_clothing men_clothing vegetables men_clothing laptop men_clothing,cart remove electronics camera search checkout_click books comics home remove books nonfiction checkout checkout_click fashion women_clothing home remove books nonfiction home click home_appliances microwave checkout click groceries beverages home scroll sports gym_equipment search checkout_click fashion women_clothing product remove fashion men_clothing category remove groceries vegetables home hover fashion men_clothing product click electronics laptop category checkout_click fashion men_clothing,cart remove search checkout_click home remove checkout checkout_click home remove home click checkout click home scroll search checkout_click product remove category remove home hover product click category checkout_click
