page,event,category,subcategory,X,x1
search cart profile profile category profile category category,hover hover remove add_to_cart click add_to_cart remove remove,fashion sports groceries electronics sports fashion fashion groceries,men_clothing football beverages laptop gym_equipment women_clothing women_clothing fruits,search hover fashion men_clothing cart hover sports football profile remove groceries beverages profile add_to_cart electronics laptop category click sports gym_equipment profile add_to_cart fashion women_clothing category remove fashion women_clothing category remove groceries fruits,search hover cart hover profile remove profile add_to_cart category click profile add_to_cart category remove category remove
product profile product checkout cart checkout category category checkout cart,checkout_click scroll checkout_click click checkout_click add_to_cart checkout_click click remove remove,sports groceries groceries sports electronics sports books sports groceries books,gym_equipment vegetables beverages gym_equipment camera gym_equipment comics football vegetables comics,product checkout_click sports gym_equipment profile scroll groceries vegetables product checkout_click groceries beverages checkout click sports gym_equipment cart checkout_click electronics camera checkout add_to_cart sports gym_equipment category checkout_click books comics category click sports football checkout remove groceries vegetables cart remove books comics,product checkout_click profile scroll product checkout_click checkout click cart checkout_click checkout add_to_cart category checkout_click category click checkout remove cart remove
profile search profile cart search product profile cart cart,scroll checkout_click add_to_cart add_to_cart click click remove remove checkout_click,sports books books home_appliances electronics electronics books fashion fashion,football nonfiction nonfiction refrigerator camera laptop comics men_clothing women_clothing,profile scroll sports football search checkout_click books nonfiction profile add_to_cart books nonfiction cart add_to_cart home_appliances refrigerator search click electronics camera product click electronics laptop profile remove books comics cart remove fashion men_clothing cart checkout_click fashion women_clothing,profile scroll search checkout_click profile add_to_cart cart add_to_cart search click product click profile remove cart remove cart checkout_click
profile cart search home checkout product home checkout,add_to_cart click checkout_click add_to_cart scroll click scroll click,electronics sports groceries sports home_appliances sports books sports,camera gym_equipment vegetables cricket microwave football comics cricket,profile add_to_cart electronics camera cart click sports gym_equipment search checkout_click groceries vegetables home add_to_cart sports cricket checkout scroll home_appliances microwave product click sports football home scroll books comics checkout click sports cricket,profile add_to_cart cart click search checkout_click home add_to_cart checkout scroll product click home scroll checkout click
cart search cart home checkout search home profile search home home search cart checkout,scroll click scroll hover scroll scroll checkout_click remove hover scroll hover click hover checkout_click,sports books groceries electronics books fashion groceries books fashion sports books electronics sports fashion,cricket nonfiction beverages mobile fiction men_clothing vegetables comics men_clothing football nonfiction laptop cricket men_clothing,cart scroll sports cricket search click books nonfiction cart scroll groceries beverages home hover electronics mobile checkout scroll books fiction search scroll fashion men_clothing home checkout_click groceries vegetables profile remove books comics search hover fashion men_clothing home scroll sports football home hover books nonfiction search click electronics laptop cart hover sports cricket checkout checkout_click fashion men_clothing,cart scroll search click cart scroll home hover checkout scroll search scroll home checkout_click profile remove search hover home scroll home hover search click cart hover checkout checkout_click
search checkout cart category search category search,add_to_cart remove add_to_cart scroll scroll click click,sports fashion fashion sports home_appliances sports fashion,football men_clothing men_clothing gym_equipment microwave cricket shoes,search add_to_cart sports football checkout remove fashion men_clothing cart add_to_cart fashion men_clothing category scroll sports gym_equipment search scroll home_appliances microwave category click sports cricket search click fashion shoes,search add_to_cart checkout remove cart add_to_cart category scroll search scroll category click search click
profile profile cart checkout profile category checkout checkout product cart product product product category home,hover scroll remove hover click click hover add_to_cart scroll checkout_click click hover add_to_cart remove remove,sports fashion fashion groceries home_appliances fashion fashion groceries home_appliances fashion home_appliances electronics books books fashion,cricket shoes shoes beverages refrigerator shoes shoes vegetables refrigerator men_clothing refrigerator laptop comics fiction shoes,profile hover sports cricket profile scroll fashion shoes cart remove fashion shoes checkout hover groceries beverages profile click home_appliances refrigerator category click fashion shoes checkout hover fashion shoes checkout add_to_cart groceries vegetables product scroll home_appliances refrigerator cart checkout_click fashion men_clothing product click home_appliances refrigerator product hover electronics laptop product add_to_cart books comics category remove books fiction home remove fashion shoes,profile hover profile scroll cart remove checkout hover profile click category click checkout hover checkout add_to_cart product scroll cart checkout_click product click product hover product add_to_cart category remove home remove
checkout home product category profile profile checkout,remove scroll click remove scroll click checkout_click,groceries home_appliances books fashion electronics fashion electronics,vegetables microwave fiction men_clothing mobile men_clothing mobile,checkout remove groceries vegetables home scroll home_appliances microwave product click books fiction category remove fashion men_clothing profile scroll electronics mobile profile click fashion men_clothing checkout checkout_click electronics mobile,checkout remove home scroll product click category remove profile scroll profile click checkout checkout_click
checkout product cart profile category category search checkout,checkout_click hover scroll add_to_cart checkout_click add_to_cart click click,groceries sports books fashion home_appliances books sports groceries,beverages football comics women_clothing refrigerator fiction gym_equipment fruits,checkout checkout_click groceries beverages product hover sports football cart scroll books comics profile add_to_cart fashion women_clothing category checkout_click home_appliances refrigerator category add_to_cart books fiction search click sports gym_equipment checkout click groceries fruits,checkout checkout_click product hover cart scroll profile add_to_cart category checkout_click category add_to_cart search click checkout click
search profile checkout search category product,add_to_cart checkout_click remove add_to_cart checkout_click scroll,home_appliances fashion groceries groceries fashion electronics,washing_machine women_clothing vegetables beverages men_clothing mobile,search add_to_cart home_appliances washing_machine profile checkout_click fashion women_clothing checkout remove groceries vegetables search add_to_cart groceries beverages category checkout_click fashion men_clothing product scroll electronics mobile,search add_to_cart profile checkout_click checkout remove search add_to_cart category checkout_click product scroll
search profile product cart search home search profile cart profile cart,scroll hover hover hover click click scroll remove checkout_click hover hover,electronics groceries groceries books groceries electronics home_appliances books electronics groceries electronics,camera fruits fruits comics beverages mobile washing_machine comics mobile vegetables camera,search scroll electronics camera profile hover groceries fruits product hover groceries fruits cart hover books comics search click groceries beverages home click electronics mobile search scroll home_appliances washing_machine profile remove books comics cart checkout_click electronics mobile profile hover groceries vegetables cart hover electronics camera,search scroll profile hover product hover cart hover search click home click search scroll profile remove cart checkout_click profile hover cart hover
checkout search profile category profile home profile cart product cart cart category,hover remove add_to_cart hover checkout_click add_to_cart hover scroll click remove click scroll,groceries electronics electronics groceries fashion sports groceries books home_appliances sports fashion groceries,fruits mobile laptop beverages women_clothing football beverages comics microwave gym_equipment women_clothing vegetables,checkout hover groceries fruits search remove electronics mobile profile add_to_cart electronics laptop category hover groceries beverages profile checkout_click fashion women_clothing home add_to_cart sports football profile hover groceries beverages cart scroll books comics product click home_appliances microwave cart remove sports gym_equipment cart click fashion women_clothing category scroll groceries vegetables,checkout hover search remove profile add_to_cart category hover profile checkout_click home add_to_cart profile hover cart scroll product click cart remove cart click category scroll
profile cart checkout category cart home product,hover remove checkout_click remove remove checkout_click hover,electronics electronics sports sports fashion electronics fashion,mobile mobile cricket gym_equipment shoes laptop men_clothing,profile hover electronics mobile cart remove electronics mobile checkout checkout_click sports cricket category remove sports gym_equipment cart remove fashion shoes home checkout_click electronics laptop product hover fashion men_clothing,profile hover cart remove checkout checkout_click category remove cart remove home checkout_click product hover
home profile search product home profile product profile profile category checkout category home,remove hover hover scroll add_to_cart remove remove click scroll add_to_cart scroll click scroll,electronics home_appliances fashion books home_appliances fashion electronics sports sports fashion fashion electronics sports,mobile refrigerator women_clothing comics washing_machine women_clothing mobile gym_equipment cricket men_clothing women_clothing camera cricket,home remove electronics mobile profile hover home_appliances refrigerator search hover fashion women_clothing product scroll books comics home add_to_cart home_appliances washing_machine profile remove fashion women_clothing product remove electronics mobile profile click sports gym_equipment profile scroll sports cricket category add_to_cart fashion men_clothing checkout scroll fashion women_clothing category click electronics camera home scroll sports cricket,home remove profile hover search hover product scroll home add_to_cart profile remove product remove profile click profile scroll category add_to_cart checkout scroll category click home scroll
checkout checkout category cart profile checkout,remove remove click click checkout_click hover,groceries fashion home_appliances groceries groceries groceries,vegetables men_clothing washing_machine beverages vegetables beverages,checkout remove groceries vegetables checkout remove fashion men_clothing category click home_appliances washing_machine cart click groceries beverages profile checkout_click groceries vegetables checkout hover groceries beverages,checkout remove checkout remove category click cart click profile checkout_click checkout hover
checkout product category profile category profile profile home home,checkout_click scroll remove add_to_cart click remove checkout_click remove hover,sports electronics fashion groceries books home_appliances groceries groceries groceries,gym_equipment laptop shoes fruits nonfiction refrigerator beverages vegetables beverages,checkout checkout_click sports gym_equipment product scroll electronics laptop category remove fashion shoes profile add_to_cart groceries fruits category click books nonfiction profile remove home_appliances refrigerator profile checkout_click groceries beverages home remove groceries vegetables home hover groceries beverages,checkout checkout_click product scroll category remove profile add_to_cart category click profile remove profile checkout_click home remove home hover
checkout home search cart search,remove add_to_cart click hover scroll,groceries home_appliances groceries books electronics,beverages washing_machine beverages fiction laptop,checkout remove groceries beverages home add_to_cart home_appliances washing_machine search click groceries beverages cart hover books fiction search scroll electronics laptop,checkout remove home add_to_cart search click cart hover search scroll
home product cart cart product category,checkout_click checkout_click checkout_click checkout_click click add_to_cart,electronics groceries home_appliances home_appliances fashion fashion,mobile fruits microwave refrigerator men_clothing women_clothing,home checkout_click electronics mobile product checkout_click groceries fruits cart checkout_click home_appliances microwave cart checkout_click home_appliances refrigerator product click fashion men_clothing category add_to_cart fashion women_clothing,home checkout_click product checkout_click cart checkout_click cart checkout_click product click category add_to_cart
home product category category checkout,checkout_click checkout_click remove checkout_click remove,home_appliances home_appliances sports groceries electronics,microwave refrigerator gym_equipment fruits laptop,home checkout_click home_appliances microwave product checkout_click home_appliances refrigerator category remove sports gym_equipment category checkout_click groceries fruits checkout remove electronics laptop,home checkout_click product checkout_click category remove category checkout_click checkout remove
checkout category product cart search checkout product product search home home cart,checkout_click remove scroll remove scroll checkout_click hover click checkout_click add_to_cart hover remove,fashion fashion books books home_appliances electronics fashion groceries electronics books home_appliances groceries,women_clothing women_clothing comics fiction washing_machine camera women_clothing vegetables camera comics refrigerator fruits,checkout checkout_click fashion women_clothing category remove fashion women_clothing product scroll books comics cart remove books fiction search scroll home_appliances washing_machine checkout checkout_click electronics camera product hover fashion women_clothing product click groceries vegetables search checkout_click electronics camera home add_to_cart books comics home hover home_appliances refrigerator cart remove groceries fruits,checkout checkout_click category remove product scroll cart remove search scroll checkout checkout_click product hover product click search checkout_click home add_to_cart home hover cart remove
checkout checkout home cart product product home search category home category search,add_to_cart remove click add_to_cart checkout_click hover hover add_to_cart add_to_cart hover scroll add_to_cart,fashion home_appliances books home_appliances groceries electronics electronics electronics fashion sports sports fashion,shoes washing_machine fiction washing_machine fruits laptop mobile mobile women_clothing football gym_equipment men_clothing,checkout add_to_cart fashion shoes checkout remove home_appliances washing_machine home click books fiction cart add_to_cart home_appliances washing_machine product checkout_click groceries fruits product hover electronics laptop home hover electronics mobile search add_to_cart electronics mobile category add_to_cart fashion women_clothing home hover sports football category scroll sports gym_equipment search add_to_cart fashion men_clothing,checkout add_to_cart checkout remove home click cart add_to_cart product checkout_click product hover home hover search add_to_cart category add_to_cart home hover category scroll search add_to_cart
search profile product cart cart category category search category product,click checkout_click add_to_cart hover checkout_click checkout_click checkout_click remove click scroll,fashion electronics electronics groceries sports books sports books sports sports,men_clothing laptop camera fruits cricket nonfiction cricket comics cricket gym_equipment,search click fashion men_clothing profile checkout_click electronics laptop product add_to_cart electronics camera cart hover groceries fruits cart checkout_click sports cricket category checkout_click books nonfiction category checkout_click sports cricket search remove books comics category click sports cricket product scroll sports gym_equipment,search click profile checkout_click product add_to_cart cart hover cart checkout_click category checkout_click category checkout_click search remove category click product scroll
profile home checkout category profile search home product cart product search checkout checkout,add_to_cart remove remove checkout_click remove add_to_cart remove hover checkout_click click click add_to_cart add_to_cart,sports electronics fashion groceries home_appliances books home_appliances electronics home_appliances home_appliances electronics books sports,gym_equipment laptop shoes beverages microwave comics microwave mobile refrigerator refrigerator camera comics gym_equipment,profile add_to_cart sports gym_equipment home remove electronics laptop checkout remove fashion shoes category checkout_click groceries beverages profile remove home_appliances microwave search add_to_cart books comics home remove home_appliances microwave product hover electronics mobile cart checkout_click home_appliances refrigerator product click home_appliances refrigerator search click electronics camera checkout add_to_cart books comics checkout add_to_cart sports gym_equipment,profile add_to_cart home remove checkout remove category checkout_click profile remove search add_to_cart home remove product hover cart checkout_click product click search click checkout add_to_cart checkout add_to_cart
product search cart home category profile cart profile category product profile profile home,click checkout_click hover checkout_click click click add_to_cart hover scroll checkout_click scroll checkout_click remove,fashion electronics home_appliances electronics electronics groceries sports sports electronics electronics electronics books home_appliances,shoes camera washing_machine mobile mobile vegetables football cricket mobile mobile camera fiction washing_machine,product click fashion shoes search checkout_click electronics camera cart hover home_appliances washing_machine home checkout_click electronics mobile category click electronics mobile profile click groceries vegetables cart add_to_cart sports football profile hover sports cricket category scroll electronics mobile product checkout_click electronics mobile profile scroll electronics camera profile checkout_click books fiction home remove home_appliances washing_machine,product click search checkout_click cart hover home checkout_click category click profile click cart add_to_cart profile hover category scroll product checkout_click profile scroll profile checkout_click home remove
checkout checkout checkout profile profile product checkout search product product checkout home product,remove hover add_to_cart checkout_click click add_to_cart remove add_to_cart add_to_cart add_to_cart add_to_cart scroll add_to_cart,books sports sports sports groceries electronics electronics books groceries books fashion fashion groceries,comics gym_equipment gym_equipment football fruits mobile camera comics vegetables fiction men_clothing shoes beverages,checkout remove books comics checkout hover sports gym_equipment checkout add_to_cart sports gym_equipment profile checkout_click sports football profile click groceries fruits product add_to_cart electronics mobile checkout remove electronics camera search add_to_cart books comics product add_to_cart groceries vegetables product add_to_cart books fiction checkout add_to_cart fashion men_clothing home scroll fashion shoes product add_to_cart groceries beverages,checkout remove checkout hover checkout add_to_cart profile checkout_click profile click product add_to_cart checkout remove search add_to_cart product add_to_cart product add_to_cart checkout add_to_cart home scroll product add_to_cart
cart checkout product home checkout home profile product checkout home checkout profile profile profile search,click click remove hover click scroll add_to_cart add_to_cart hover add_to_cart click scroll add_to_cart hover add_to_cart,sports electronics home_appliances fashion home_appliances electronics home_appliances fashion groceries home_appliances electronics electronics groceries electronics home_appliances,gym_equipment laptop refrigerator men_clothing washing_machine camera refrigerator men_clothing vegetables washing_machine camera camera fruits laptop refrigerator,cart click sports gym_equipment checkout click electronics laptop product remove home_appliances refrigerator home hover fashion men_clothing checkout click home_appliances washing_machine home scroll electronics camera profile add_to_cart home_appliances refrigerator product add_to_cart fashion men_clothing checkout hover groceries vegetables home add_to_cart home_appliances washing_machine checkout click electronics camera profile scroll electronics camera profile add_to_cart groceries fruits profile hover electronics laptop search add_to_cart home_appliances refrigerator,cart click checkout click product remove home hover checkout click home scroll profile add_to_cart product add_to_cart checkout hover home add_to_cart checkout click profile scroll profile add_to_cart profile hover search add_to_cart
cart cart product home product profile product home product cart checkout checkout category,hover remove checkout_click hover remove checkout_click checkout_click checkout_click checkout_click checkout_click scroll click remove,books sports fashion groceries home_appliances groceries groceries electronics fashion fashion sports electronics books,comics cricket women_clothing vegetables refrigerator vegetables fruits laptop men_clothing men_clothing football camera comics,cart hover books comics cart remove sports cricket product checkout_click fashion women_clothing home hover groceries vegetables product remove home_appliances refrigerator profile checkout_click groceries vegetables product checkout_click groceries fruits home checkout_click electronics laptop product checkout_click fashion men_clothing cart checkout_click fashion men_clothing checkout scroll sports football checkout click electronics camera category remove books comics,cart hover cart remove product checkout_click home hover product remove profile checkout_click product checkout_click home checkout_click product checkout_click cart checkout_click checkout scroll checkout click category remove
cart home profile product checkout profile category search checkout,remove remove checkout_click checkout_click remove add_to_cart checkout_click scroll hover,electronics groceries fashion sports electronics sports fashion sports groceries,laptop beverages shoes gym_equipment laptop cricket women_clothing football vegetables,cart remove electronics laptop home remove groceries beverages profile checkout_click fashion shoes product checkout_click sports gym_equipment checkout remove electronics laptop profile add_to_cart sports cricket category checkout_click fashion women_clothing search scroll sports football checkout hover groceries vegetables,cart remove home remove profile checkout_click product checkout_click checkout remove profile add_to_cart category checkout_click search scroll checkout hover
home product checkout home cart search,click hover click remove checkout_click click,sports fashion electronics sports sports home_appliances,football women_clothing laptop gym_equipment football refrigerator,home click sports football product hover fashion women_clothing checkout click electronics laptop home remove sports gym_equipment cart checkout_click sports football search click home_appliances refrigerator,home click product hover checkout click home remove cart checkout_click search click
