page,event,category,subcategory,X,x1
category search checkout home category profile,scroll click scroll scroll remove scroll,fashion books groceries books groceries fashion,men_clothing nonfiction fruits nonfiction fruits men_clothing,category scroll fashion men_clothing search click books nonfiction checkout scroll groceries fruits home scroll books nonfiction category remove groceries fruits profile scroll fashion men_clothing,category scroll search click checkout scroll home scroll category remove profile scroll
product product cart profile product,remove remove add_to_cart checkout_click checkout_click,home_appliances books books electronics groceries,microwave nonfiction comics camera vegetables,product remove home_appliances microwave product remove books nonfiction cart add_to_cart books comics profile checkout_click electronics camera product checkout_click groceries vegetables,product remove product remove cart add_to_cart profile checkout_click product checkout_click
category home product product cart,remove hover scroll hover remove,electronics sports books home_appliances home_appliances,camera cricket nonfiction microwave refrigerator,category remove electronics camera home hover sports cricket product scroll books nonfiction product hover home_appliances microwave cart remove home_appliances refrigerator,category remove home hover product scroll product hover cart remove
search profile profile search search,scroll add_to_cart add_to_cart add_to_cart scroll,electronics books electronics groceries home_appliances,mobile comics mobile beverages microwave,search scroll electronics mobile profile add_to_cart books comics profile add_to_cart electronics mobile search add_to_cart groceries beverages search scroll home_appliances microwave,search scroll profile add_to_cart profile add_to_cart search add_to_cart search scroll
home product search search category checkout checkout product cart home product,scroll add_to_cart click add_to_cart add_to_cart scroll hover scroll scroll click checkout_click,books books sports groceries electronics groceries groceries books sports electronics books,fiction comics gym_equipment beverages camera beverages beverages comics gym_equipment mobile comics,home scroll books fiction product add_to_cart books comics search click sports gym_equipment search add_to_cart groceries beverages category add_to_cart electronics camera checkout scroll groceries beverages checkout hover groceries beverages product scroll books comics cart scroll sports gym_equipment home click electronics mobile product checkout_click books comics,home scroll product add_to_cart search click search add_to_cart category add_to_cart checkout scroll checkout hover product scroll cart scroll home click product checkout_click
product home home home home product search checkout profile category home category profile,add_to_cart remove scroll add_to_cart hover checkout_click scroll click remove hover checkout_click scroll scroll,books home_appliances sports books home_appliances electronics sports home_appliances books fashion fashion books sports,comics washing_machine gym_equipment fiction refrigerator mobile cricket microwave nonfiction men_clothing men_clothing fiction football,product add_to_cart books comics home remove home_appliances washing_machine home scroll sports gym_equipment home add_to_cart books fiction home hover home_appliances refrigerator product checkout_click electronics mobile search scroll sports cricket checkout click home_appliances microwave profile remove books nonfiction category hover fashion men_clothing home checkout_click fashion men_clothing category scroll books fiction profile scroll sports football,product add_to_cart home remove home scroll home add_to_cart home hover product checkout_click search scroll checkout click profile remove category hover home checkout_click category scroll profile scroll
product search product checkout product category profile checkout product cart search cart cart,remove add_to_cart remove scroll click add_to_cart scroll add_to_cart hover scroll checkout_click remove click,groceries groceries electronics groceries home_appliances fashion home_appliances books electronics groceries groceries groceries books,vegetables fruits mobile beverages refrigerator women_clothing washing_machine fiction mobile beverages beverages beverages fiction,product remove groceries vegetables search add_to_cart groceries fruits product remove electronics mobile checkout scroll groceries beverages product click home_appliances refrigerator category add_to_cart fashion women_clothing profile scroll home_appliances washing_machine checkout add_to_cart books fiction product hover electronics mobile cart scroll groceries beverages search checkout_click groceries beverages cart remove groceries beverages cart click books fiction,product remove search add_to_cart product remove checkout scroll product click category add_to_cart profile scroll checkout add_to_cart product hover cart scroll search checkout_click cart remove cart click
search checkout home cart search cart search home profile profile checkout product profile profile cart,hover remove add_to_cart remove hover checkout_click add_to_cart hover click scroll checkout_click checkout_click checkout_click hover hover,fashion electronics electronics fashion sports sports books fashion home_appliances electronics fashion home_appliances books fashion sports,shoes laptop laptop men_clothing football cricket nonfiction shoes washing_machine laptop men_clothing refrigerator comics women_clothing football,search hover fashion shoes checkout remove electronics laptop home add_to_cart electronics laptop cart remove fashion men_clothing search hover sports football cart checkout_click sports cricket search add_to_cart books nonfiction home hover fashion shoes profile click home_appliances washing_machine profile scroll electronics laptop checkout checkout_click fashion men_clothing product checkout_click home_appliances refrigerator profile checkout_click books comics profile hover fashion women_clothing cart hover sports football,search hover checkout remove home add_to_cart cart remove search hover cart checkout_click search add_to_cart home hover profile click profile scroll checkout checkout_click product checkout_click profile checkout_click profile hover cart hover
checkout cart checkout search search search category home home category category search cart,scroll click remove hover hover checkout_click scroll remove click hover remove remove click,sports groceries groceries books groceries electronics groceries electronics sports home_appliances home_appliances fashion home_appliances,football vegetables fruits fiction vegetables camera fruits camera cricket refrigerator microwave men_clothing microwave,checkout scroll sports football cart click groceries vegetables checkout remove groceries fruits search hover books fiction search hover groceries vegetables search checkout_click electronics camera category scroll groceries fruits home remove electronics camera home click sports cricket category hover home_appliances refrigerator category remove home_appliances microwave search remove fashion men_clothing cart click home_appliances microwave,checkout scroll cart click checkout remove search hover search hover search checkout_click category scroll home remove home click category hover category remove search remove cart click
checkout product search checkout product product home profile category cart category product product category,remove remove hover click click add_to_cart hover hover hover add_to_cart remove click scroll click,books books sports fashion books fashion home_appliances fashion electronics books groceries groceries sports books,nonfiction fiction gym_equipment women_clothing comics shoes washing_machine men_clothing camera fiction beverages beverages cricket fiction,checkout remove books nonfiction product remove books fiction search hover sports gym_equipment checkout click fashion women_clothing product click books comics product add_to_cart fashion shoes home hover home_appliances washing_machine profile hover fashion men_clothing category hover electronics camera cart add_to_cart books fiction category remove groceries beverages product click groceries beverages product scroll sports cricket category click books fiction,checkout remove product remove search hover checkout click product click product add_to_cart home hover profile hover category hover cart add_to_cart category remove product click product scroll category click
checkout checkout profile product product home search,hover hover checkout_click add_to_cart remove remove checkout_click,groceries fashion sports books books books fashion,fruits men_clothing cricket nonfiction comics nonfiction shoes,checkout hover groceries fruits checkout hover fashion men_clothing profile checkout_click sports cricket product add_to_cart books nonfiction product remove books comics home remove books nonfiction search checkout_click fashion shoes,checkout hover checkout hover profile checkout_click product add_to_cart product remove home remove search checkout_click
checkout product product home cart,scroll hover checkout_click hover add_to_cart,electronics groceries fashion groceries home_appliances,laptop fruits women_clothing vegetables microwave,checkout scroll electronics laptop product hover groceries fruits product checkout_click fashion women_clothing home hover groceries vegetables cart add_to_cart home_appliances microwave,checkout scroll product hover product checkout_click home hover cart add_to_cart
cart home search product search checkout home search cart home checkout cart product,hover click hover add_to_cart checkout_click checkout_click scroll checkout_click hover click checkout_click scroll checkout_click,home_appliances home_appliances home_appliances books fashion sports groceries home_appliances sports sports home_appliances groceries home_appliances,microwave refrigerator microwave comics shoes cricket fruits washing_machine cricket football refrigerator beverages refrigerator,cart hover home_appliances microwave home click home_appliances refrigerator search hover home_appliances microwave product add_to_cart books comics search checkout_click fashion shoes checkout checkout_click sports cricket home scroll groceries fruits search checkout_click home_appliances washing_machine cart hover sports cricket home click sports football checkout checkout_click home_appliances refrigerator cart scroll groceries beverages product checkout_click home_appliances refrigerator,cart hover home click search hover product add_to_cart search checkout_click checkout checkout_click home scroll search checkout_click cart hover home click checkout checkout_click cart scroll product checkout_click
checkout cart product search checkout,scroll add_to_cart remove checkout_click add_to_cart,sports sports groceries fashion electronics,football gym_equipment fruits shoes mobile,checkout scroll sports football cart add_to_cart sports gym_equipment product remove groceries fruits search checkout_click fashion shoes checkout add_to_cart electronics mobile,checkout scroll cart add_to_cart product remove search checkout_click checkout add_to_cart
category category home product product cart profile product home profile search cart profile profile cart,add_to_cart checkout_click hover remove hover add_to_cart checkout_click scroll hover add_to_cart checkout_click remove scroll click checkout_click,home_appliances electronics sports home_appliances sports fashion electronics books home_appliances fashion electronics sports electronics electronics sports,washing_machine laptop football refrigerator football men_clothing laptop fiction refrigerator men_clothing laptop gym_equipment laptop mobile gym_equipment,category add_to_cart home_appliances washing_machine category checkout_click electronics laptop home hover sports football product remove home_appliances refrigerator product hover sports football cart add_to_cart fashion men_clothing profile checkout_click electronics laptop product scroll books fiction home hover home_appliances refrigerator profile add_to_cart fashion men_clothing search checkout_click electronics laptop cart remove sports gym_equipment profile scroll electronics laptop profile click electronics mobile cart checkout_click sports gym_equipment,category add_to_cart category checkout_click home hover product remove product hover cart add_to_cart profile checkout_click product scroll home hover profile add_to_cart search checkout_click cart remove profile scroll profile click cart checkout_click
home cart cart home search checkout,scroll remove click scroll hover remove,sports sports electronics home_appliances groceries electronics,cricket gym_equipment laptop washing_machine fruits camera,home scroll sports cricket cart remove sports gym_equipment cart click electronics laptop home scroll home_appliances washing_machine search hover groceries fruits checkout remove electronics camera,home scroll cart remove cart click home scroll search hover checkout remove
cart checkout cart cart search search cart category product,click checkout_click scroll scroll click add_to_cart remove hover remove,books home_appliances fashion groceries electronics books fashion books home_appliances,comics refrigerator shoes vegetables camera comics men_clothing comics washing_machine,cart click books comics checkout checkout_click home_appliances refrigerator cart scroll fashion shoes cart scroll groceries vegetables search click electronics camera search add_to_cart books comics cart remove fashion men_clothing category hover books comics product remove home_appliances washing_machine,cart click checkout checkout_click cart scroll cart scroll search click search add_to_cart cart remove category hover product remove
cart category cart product home cart category category search category category category category,checkout_click hover add_to_cart add_to_cart scroll checkout_click scroll add_to_cart hover add_to_cart add_to_cart add_to_cart checkout_click,home_appliances books books home_appliances home_appliances sports home_appliances fashion electronics home_appliances home_appliances books electronics,refrigerator comics comics washing_machine refrigerator gym_equipment washing_machine shoes mobile refrigerator microwave comics laptop,cart checkout_click home_appliances refrigerator category hover books comics cart add_to_cart books comics product add_to_cart home_appliances washing_machine home scroll home_appliances refrigerator cart checkout_click sports gym_equipment category scroll home_appliances washing_machine category add_to_cart fashion shoes search hover electronics mobile category add_to_cart home_appliances refrigerator category add_to_cart home_appliances microwave category add_to_cart books comics category checkout_click electronics laptop,cart checkout_click category hover cart add_to_cart product add_to_cart home scroll cart checkout_click category scroll category add_to_cart search hover category add_to_cart category add_to_cart category add_to_cart category checkout_click
product checkout product home profile product cart checkout category category product,checkout_click add_to_cart hover checkout_click click click checkout_click click remove hover checkout_click,groceries home_appliances home_appliances sports groceries electronics fashion home_appliances fashion fashion home_appliances,fruits microwave microwave football fruits mobile women_clothing refrigerator men_clothing women_clothing washing_machine,product checkout_click groceries fruits checkout add_to_cart home_appliances microwave product hover home_appliances microwave home checkout_click sports football profile click groceries fruits product click electronics mobile cart checkout_click fashion women_clothing checkout click home_appliances refrigerator category remove fashion men_clothing category hover fashion women_clothing product checkout_click home_appliances washing_machine,product checkout_click checkout add_to_cart product hover home checkout_click profile click product click cart checkout_click checkout click category remove category hover product checkout_click
product profile profile home cart checkout cart checkout home profile home,remove click add_to_cart click click checkout_click hover checkout_click hover scroll checkout_click,sports groceries fashion groceries home_appliances books electronics fashion electronics electronics sports,football vegetables women_clothing fruits microwave fiction camera women_clothing mobile camera gym_equipment,product remove sports football profile click groceries vegetables profile add_to_cart fashion women_clothing home click groceries fruits cart click home_appliances microwave checkout checkout_click books fiction cart hover electronics camera checkout checkout_click fashion women_clothing home hover electronics mobile profile scroll electronics camera home checkout_click sports gym_equipment,product remove profile click profile add_to_cart home click cart click checkout checkout_click cart hover checkout checkout_click home hover profile scroll home checkout_click
home profile search category home home cart product product category,checkout_click add_to_cart add_to_cart scroll hover remove remove checkout_click hover click,fashion sports electronics groceries groceries home_appliances books home_appliances groceries fashion,women_clothing gym_equipment camera fruits fruits microwave nonfiction refrigerator fruits women_clothing,home checkout_click fashion women_clothing profile add_to_cart sports gym_equipment search add_to_cart electronics camera category scroll groceries fruits home hover groceries fruits home remove home_appliances microwave cart remove books nonfiction product checkout_click home_appliances refrigerator product hover groceries fruits category click fashion women_clothing,home checkout_click profile add_to_cart search add_to_cart category scroll home hover home remove cart remove product checkout_click product hover category click
profile home search home cart,remove scroll checkout_click remove click,sports fashion sports fashion sports,football men_clothing gym_equipment women_clothing cricket,profile remove sports football home scroll fashion men_clothing search checkout_click sports gym_equipment home remove fashion women_clothing cart click sports cricket,profile remove home scroll search checkout_click home remove cart click
category cart category home home checkout home,hover hover checkout_click remove click hover checkout_click,books groceries fashion groceries groceries books groceries,comics beverages shoes beverages beverages nonfiction vegetables,category hover books comics cart hover groceries beverages category checkout_click fashion shoes home remove groceries beverages home click groceries beverages checkout hover books nonfiction home checkout_click groceries vegetables,category hover cart hover category checkout_click home remove home click checkout hover home checkout_click
search category category search checkout,checkout_click scroll click hover add_to_cart,groceries home_appliances fashion fashion sports,beverages washing_machine men_clothing women_clothing gym_equipment,search checkout_click groceries beverages category scroll home_appliances washing_machine category click fashion men_clothing search hover fashion women_clothing checkout add_to_cart sports gym_equipment,search checkout_click category scroll category click search hover checkout add_to_cart
checkout search product checkout profile cart checkout category search home,checkout_click click click add_to_cart remove remove click add_to_cart add_to_cart scroll,electronics home_appliances books electronics books home_appliances sports groceries books electronics,camera refrigerator nonfiction mobile fiction microwave football fruits comics camera,checkout checkout_click electronics camera search click home_appliances refrigerator product click books nonfiction checkout add_to_cart electronics mobile profile remove books fiction cart remove home_appliances microwave checkout click sports football category add_to_cart groceries fruits search add_to_cart books comics home scroll electronics camera,checkout checkout_click search click product click checkout add_to_cart profile remove cart remove checkout click category add_to_cart search add_to_cart home scroll
checkout category cart profile cart product cart search category profile profile profile home home,hover remove scroll scroll remove scroll click hover click checkout_click remove hover hover scroll,electronics groceries home_appliances electronics electronics electronics books sports fashion books fashion books groceries groceries,mobile beverages refrigerator camera laptop mobile fiction gym_equipment men_clothing fiction men_clothing nonfiction fruits vegetables,checkout hover electronics mobile category remove groceries beverages cart scroll home_appliances refrigerator profile scroll electronics camera cart remove electronics laptop product scroll electronics mobile cart click books fiction search hover sports gym_equipment category click fashion men_clothing profile checkout_click books fiction profile remove fashion men_clothing profile hover books nonfiction home hover groceries fruits home scroll groceries vegetables,checkout hover category remove cart scroll profile scroll cart remove product scroll cart click search hover category click profile checkout_click profile remove profile hover home hover home scroll
product cart search category category profile cart cart checkout home checkout,scroll hover checkout_click click scroll hover remove remove hover checkout_click hover,fashion electronics groceries electronics electronics books books sports groceries groceries groceries,men_clothing camera vegetables laptop camera comics nonfiction cricket fruits vegetables fruits,product scroll fashion men_clothing cart hover electronics camera search checkout_click groceries vegetables category click electronics laptop category scroll electronics camera profile hover books comics cart remove books nonfiction cart remove sports cricket checkout hover groceries fruits home checkout_click groceries vegetables checkout hover groceries fruits,product scroll cart hover search checkout_click category click category scroll profile hover cart remove cart remove checkout hover home checkout_click checkout hover
search profile category cart home home category checkout checkout checkout,checkout_click add_to_cart click checkout_click add_to_cart checkout_click add_to_cart click scroll hover,home_appliances books fashion groceries fashion books books books fashion books,washing_machine fiction women_clothing fruits men_clothing fiction fiction fiction shoes fiction,search checkout_click home_appliances washing_machine profile add_to_cart books fiction category click fashion women_clothing cart checkout_click groceries fruits home add_to_cart fashion men_clothing home checkout_click books fiction category add_to_cart books fiction checkout click books fiction checkout scroll fashion shoes checkout hover books fiction,search checkout_click profile add_to_cart category click cart checkout_click home add_to_cart home checkout_click category add_to_cart checkout click checkout scroll checkout hover
search search profile home cart checkout product search checkout category profile cart checkout,click hover remove hover click click scroll checkout_click add_to_cart checkout_click remove hover checkout_click,electronics sports fashion books groceries home_appliances books books books groceries books fashion sports,laptop cricket women_clothing fiction beverages refrigerator nonfiction comics nonfiction beverages comics men_clothing gym_equipment,search click electronics laptop search hover sports cricket profile remove fashion women_clothing home hover books fiction cart click groceries beverages checkout click home_appliances refrigerator product scroll books nonfiction search checkout_click books comics checkout add_to_cart books nonfiction category checkout_click groceries beverages profile remove books comics cart hover fashion men_clothing checkout checkout_click sports gym_equipment,search click search hover profile remove home hover cart click checkout click product scroll search checkout_click checkout add_to_cart category checkout_click profile remove cart hover checkout checkout_click
product cart checkout profile product product checkout,click checkout_click checkout_click checkout_click click click hover,fashion fashion fashion fashion home_appliances home_appliances home_appliances,women_clothing men_clothing shoes shoes microwave refrigerator refrigerator,product click fashion women_clothing cart checkout_click fashion men_clothing checkout checkout_click fashion shoes profile checkout_click fashion shoes product click home_appliances microwave product click home_appliances refrigerator checkout hover home_appliances refrigerator,product click cart checkout_click checkout checkout_click profile checkout_click product click product click checkout hover
